{
	"$schema": "https://json-schema.org/draft/2020-12/schema",
	"$id": "https://example.com/banda.schema.json",
	"title": "Banda Validator",
	"type": "object",
	"properties": {
		"group": {
			"type": "string",
			"minLength": 3,
			"maxLength": 50
		},
		"foundation_year": {
			"type": "string",
  			"format": "date"
		},
		"web": {
			"type": "string",
			"format": "uri"
		},
		"email": {
			"type": "string",
			"format": "email"
		},
		"description": {
			"type": "string",
			"minLength": 50,
			"maxLength": 500
		},
		"members": {
			"type": "array",
			"minItems": 2,
			"maxItems": 10,
			"uniqueItems": true,
			"items": [
				{
					"type": "object",
					"properties": {
						"name": { "type": "string"},
						"edad": { "type": "number", "minimum": 0, "maximum": 120}
					}
				}
			]
		},
		"albums": {
			"type": "array",
			"minItems": 1,
			"uniqueItems": true, 
			"items": [
				{
					"type": "object",
					"properties": {
						"name": { "type": "string"},
						"year": { "type": "number", "minimum": 1900, "maximum": 2099},
						"songs": { "type": "array", "items": [
							{
								"type": "object",
								"properties": {
									"name": { "type": "string"},
									"length": { "type": "string", "format": "time"},
									"hit": { "type": "boolean"}
								}
							}
						]}
					}
				}
			]
		},
		"concerts": {
			"type": "array",
			"uniqueItems": true,
			"minItems": 1,
			"maxItems": 20,
			"items": [
				{ "type": "string"}
			]
		}
	},
	"required": ["group", "foundation_year", "web", "email", "description", "members", "albums", "concerts"]
}